{
  "schema_version": 1,
  "screen_id": "main_menu",
  "display_name": "主界面",
  "transient": false,
  "description": "示例：仅演示文件格式，截图不随仓库入库。",
  "samples": [
    "shots/main_menu_001.png",
    "shots/main_menu_002.png"
  ],
  "text_tags": [
    {
      "tag_id": "t1",
      "box": { "x": 0.30, "y": 0.04, "w": 0.40, "h": 0.05 },
      "expect": "主界面",
      "polarity": "pos",
      "mode": "equals",
      "source": {
        "sample": "shots/main_menu_001.png",
        "ocr_text": "主界面",
        "confidence": 0.99
      }
    },
    {
      "tag_id": "t2",
      "box": { "x": 0.05, "y": 0.90, "w": 0.16, "h": 0.06 },
      "expect": "背包",
      "polarity": "pos",
      "mode": "contains",
      "source": {
        "sample": "shots/main_menu_001.png",
        "ocr_text": "背包",
        "confidence": 0.97
      }
    },
    {
      "tag_id": "t3",
      "box": { "x": 0.27, "y": 0.90, "w": 0.16, "h": 0.06 },
      "expect": "商城",
      "polarity": "pos",
      "mode": "contains"
    },
    {
      "tag_id": "t4",
      "box": { "x": 0.15, "y": 0.30, "w": 0.70, "h": 0.35 },
      "expect": "首充礼包",
      "polarity": "neg",
      "mode": "contains",
      "comment": "弹窗盖层文本：出现即说明当前被弹窗遮罩，不算主界面。"
    }
  ],
  "anchors": [
    {
      "anchor": "btn_setting",
      "present": true,
      "box": { "x": 0.71, "y": 0.90, "w": 0.16, "h": 0.06 }
    },
    {
      "anchor": "btn_close_popup",
      "present": false,
      "box": { "x": 0.72, "y": 0.055, "w": 0.10, "h": 0.06 },
      "comment": "阶段 B 预留：主界面不该出现弹窗关闭按钮。"
    }
  ],
  "meta": {
    "created_by": "ui-annotator@0.1.0",
    "created_at": "2025-09-07T20:00:00+08:00",
    "updated_at": "2025-09-07T20:00:00+08:00",
    "screen_version": 1
  }
}
